{
    "$schema": "http://json-schema.org/draft-07/schema#",
    "title": "Typst Versions",
    "description": "Typst versions and their compatible commands",
    "type": "object",
    "definitions": {
        "stable_version": {
            "type": "string",
            "pattern": "^\\d+\\.\\d+\\.\\d+$"
        },
        "all_version": {
            "type": "string",
            "pattern": "^\\d+\\.\\d+\\.\\d+(?:-rc(?:\\.\\d+)?)?$"
        },
        "all_version_list": {
            "type": "array",
            "items": {
                "$ref": "#/definitions/all_version"
            }
        },
        "stable_version_list": {
            "type": "array",
            "items": {
                "$ref": "#/definitions/stable_version"
            }
        }
    },
    "properties": {
        "$schema": {
            "type": "string"
        },
        "base_url": {
            "type": "string",
            "pattern": "^https://github\\.com/[a-zA-Z0-9\\-]+/[a-zA-Z0-9\\-_\\.]+$"
        },
        "version_pattern": {
            "type": "string",
            "description": "Pattern to match and extract versions from GitHub tags/releases. Use '{version}' as the placeholder for the version string (e.g., 'v{version}' or 'docs-v{version}').",
            "pattern": "\\{version\\}"
        },
        "0.15.1": {
            "$ref": "#/definitions/stable_version_list"
        },
        "0.15.0": {
            "$ref": "#/definitions/stable_version_list"
        },
        "0.14.2": {
            "$ref": "#/definitions/stable_version_list"
        },
        "0.14.1": {
            "$ref": "#/definitions/stable_version_list"
        },
        "0.14.0": {
            "$ref": "#/definitions/stable_version_list"
        },
        "0.13.1": {
            "$ref": "#/definitions/stable_version_list"
        },
        "0.13.0": {
            "$ref": "#/definitions/stable_version_list"
        },
        "0.12.0": {
            "$ref": "#/definitions/stable_version_list"
        },
        "ignores": {
            "$ref": "#/definitions/all_version_list",
            "description": "Versions that should be ignored when resolving compatible versions"
        }
    },
    "required": [
        "$schema",
        "base_url",
        "version_pattern",
        "0.15.1",
        "0.15.0",
        "0.14.2",
        "0.14.1",
        "0.14.0",
        "0.13.1",
        "0.13.0",
        "0.12.0"
    ],
    "version_ignores": [
        "0.11.1",
        "0.11.0",
        "0.10.0",
        "0.9.0",
        "0.8.0",
        "0.7.0",
        "0.6.0",
        "0.5.0",
        "0.4.0",
        "0.3.0",
        "0.2.0",
        "0.1.0"
    ],
    "additionalProperties": false
}
