{
    "$schema": "./typst_version_schema.json",
    "base_url": "https://github.com/typst-community/dev-builds",
    "version_pattern": "docs-v{version}",
    "0.15.1": [
        "0.15.1"
    ],
    "0.15.0": [
        "0.15.0"
    ],
    "0.14.2": [
        "0.14.2"
    ],
    "0.14.1": [
        "0.14.1"
    ],
    "0.14.0": [
        "0.14.0"
    ],
    "0.13.1": [
        "0.13.1"
    ],
    "0.13.0": [
        "0.13.0"
    ],
    "0.12.0": [
        "0.12.0"
    ]
}
